{"action_weights":{"administer":5,"read":1,"read_metadata":1,"read_secret":1,"write":3},"coverage":["Minimal public-record mechanism model; all unreported topology is explicitly assumed.","Authorization-level backup access is modeled after acquisition of the key; the probable JavaScript exposure mechanism is not independently reenacted."],"edges":[{"id":"auth-subject","kind":"authenticates_as","provenance":{"connector":"public-reconstruction-v1","evidence_ref":"beacon-crm-2026:assumption-mapping","observed_at":"2026-09-09T00:00:00Z","source_api":"no API called; cited public narrative"},"source":"credential-subject","target":"subject"},{"id":"assigned-reported-capability","kind":"assigned","provenance":{"connector":"public-reconstruction-v1","evidence_ref":"beacon-crm-2026:assumption-mapping","observed_at":"2026-09-09T00:00:00Z","source_api":"no API called; cited public narrative"},"source":"subject","target":"reported-capability"},{"actions":["read"],"id":"grant-reported-capability-0","kind":"grants","provenance":{"connector":"public-reconstruction-v1","evidence_ref":"beacon-crm-2026:assumption-mapping","observed_at":"2026-09-09T00:00:00Z","source_api":"no API called; cited public narrative"},"source":"reported-capability","target":"backup-collection"}],"nodes":[{"id":"subject","kind":"principal","name":"Fictional disclosed-credential role","provenance":{"connector":"public-reconstruction-v1","evidence_ref":"beacon-crm-2026:assumption-mapping","observed_at":"2026-09-09T00:00:00Z","source_api":"no API called; cited public narrative"},"provisioned_at":"2026-08-01T00:00:00Z","subtype":"service_principal"},{"id":"credential-subject","kind":"credential","name":"Fictional disclosed-credential role metadata","principal_id":"subject","provenance":{"connector":"public-reconstruction-v1","evidence_ref":"beacon-crm-2026:assumption-mapping","observed_at":"2026-09-09T00:00:00Z","source_api":"no API called; cited public narrative"},"subtype":"key"},{"actions":["read"],"id":"backup-collection","kind":"resource","name":"Fictional backup-collection","provenance":{"connector":"public-reconstruction-v1","evidence_ref":"beacon-crm-2026:assumption-mapping","observed_at":"2026-09-09T00:00:00Z","source_api":"no API called; cited public narrative"},"sensitivity":1,"subtype":"collection"},{"constraints":[],"effect":"allow","eligible":false,"id":"reported-capability","kind":"binding","name":"Fictional reported-capability","provenance":{"connector":"public-reconstruction-v1","evidence_ref":"beacon-crm-2026:assumption-mapping","observed_at":"2026-09-09T00:00:00Z","source_api":"no API called; cited public narrative"},"subtype":"role_assignment"}],"observed_at":"2026-09-09T00:00:00Z","organization":"Fictional reconstruction beacon-crm-2026","schema_version":"0.1","synthetic":true}
