{"action_weights":{"administer":5,"read":1,"read_metadata":1,"read_secret":1,"write":3},"coverage":["Minimal public-record mechanism model; all unreported topology is explicitly assumed.","The infostealer compromise precedes the model; platform vulnerabilities are not required for the modeled credential-use segment."],"edges":[{"constraints":["hypothetical-control"],"id":"auth-subject","kind":"authenticates_as","provenance":{"connector":"public-reconstruction-v1","evidence_ref":"snowflake-2024:assumption-mapping","observed_at":"2026-09-09T00:00:00Z","source_api":"no API called; cited public narrative"},"source":"credential-subject","target":"subject"},{"id":"assigned-reported-capability","kind":"assigned","provenance":{"connector":"public-reconstruction-v1","evidence_ref":"snowflake-2024:assumption-mapping","observed_at":"2026-09-09T00:00:00Z","source_api":"no API called; cited public narrative"},"source":"subject","target":"reported-capability"},{"actions":["read"],"id":"grant-reported-capability-0","kind":"grants","provenance":{"connector":"public-reconstruction-v1","evidence_ref":"snowflake-2024:assumption-mapping","observed_at":"2026-09-09T00:00:00Z","source_api":"no API called; cited public narrative"},"source":"reported-capability","target":"database-export"}],"nodes":[{"id":"subject","kind":"principal","name":"Fictional disclosed-credential role","provenance":{"connector":"public-reconstruction-v1","evidence_ref":"snowflake-2024:assumption-mapping","observed_at":"2026-09-09T00:00:00Z","source_api":"no API called; cited public narrative"},"provisioned_at":"2026-08-01T00:00:00Z","subtype":"human_user"},{"id":"credential-subject","kind":"credential","name":"Fictional disclosed-credential role metadata","principal_id":"subject","provenance":{"connector":"public-reconstruction-v1","evidence_ref":"snowflake-2024:assumption-mapping","observed_at":"2026-09-09T00:00:00Z","source_api":"no API called; cited public narrative"},"subtype":"password"},{"actions":["read"],"id":"database-export","kind":"resource","name":"Fictional database-export","provenance":{"connector":"public-reconstruction-v1","evidence_ref":"snowflake-2024:assumption-mapping","observed_at":"2026-09-09T00:00:00Z","source_api":"no API called; cited public narrative"},"sensitivity":1,"subtype":"collection"},{"constraints":[],"effect":"allow","eligible":false,"id":"reported-capability","kind":"binding","name":"Fictional reported-capability","provenance":{"connector":"public-reconstruction-v1","evidence_ref":"snowflake-2024:assumption-mapping","observed_at":"2026-09-09T00:00:00Z","source_api":"no API called; cited public narrative"},"subtype":"role_assignment"},{"id":"hypothetical-control","kind":"constraint","name":"Fictional hypothetical-control","provenance":{"connector":"synthetic-v0.1","evidence_ref":"hypothetical-control","observed_at":"2026-09-09T00:00:00Z","source_api":"invented-fixture"},"subtype":"device_required"}],"observed_at":"2026-09-09T00:00:00Z","organization":"Fictional reconstruction snowflake-2024","schema_version":"0.1","synthetic":true}
