{"action_weights":{"administer":5,"read":1,"read_metadata":1,"read_secret":1,"write":3},"coverage":["Minimal public-record mechanism model; all unreported topology is explicitly assumed.","Initial malware execution is outside scope. The contrast between default and session-aware models illustrates why the credential starting context must be declared."],"edges":[{"constraints":["completed-authentication"],"id":"auth-subject","kind":"authenticates_as","provenance":{"connector":"public-reconstruction-v1","evidence_ref":"circleci-2023:assumption-mapping","observed_at":"2026-09-09T00:00:00Z","source_api":"no API called; cited public narrative"},"source":"credential-subject","target":"subject"},{"id":"assigned-reported-capability","kind":"assigned","provenance":{"connector":"public-reconstruction-v1","evidence_ref":"circleci-2023:assumption-mapping","observed_at":"2026-09-09T00:00:00Z","source_api":"no API called; cited public narrative"},"source":"subject","target":"reported-capability"},{"actions":["read_secret"],"id":"grant-reported-capability-0","kind":"grants","provenance":{"connector":"public-reconstruction-v1","evidence_ref":"circleci-2023:assumption-mapping","observed_at":"2026-09-09T00:00:00Z","source_api":"no API called; cited public narrative"},"source":"reported-capability","target":"production-secret-collection"}],"nodes":[{"id":"subject","kind":"principal","name":"Fictional disclosed-credential role","provenance":{"connector":"public-reconstruction-v1","evidence_ref":"circleci-2023:assumption-mapping","observed_at":"2026-09-09T00:00:00Z","source_api":"no API called; cited public narrative"},"provisioned_at":"2026-08-01T00:00:00Z","subtype":"human_user"},{"id":"credential-subject","kind":"credential","name":"Fictional disclosed-credential role metadata","principal_id":"subject","provenance":{"connector":"public-reconstruction-v1","evidence_ref":"circleci-2023:assumption-mapping","observed_at":"2026-09-09T00:00:00Z","source_api":"no API called; cited public narrative"},"session_satisfied_constraints":["device_required"],"subtype":"token"},{"actions":["read_secret"],"id":"production-secret-collection","kind":"resource","name":"Fictional production-secret-collection","provenance":{"connector":"public-reconstruction-v1","evidence_ref":"circleci-2023:assumption-mapping","observed_at":"2026-09-09T00:00:00Z","source_api":"no API called; cited public narrative"},"sensitivity":1,"subtype":"secret_store"},{"constraints":["hypothetical-control"],"effect":"allow","eligible":false,"id":"reported-capability","kind":"binding","name":"Fictional reported-capability","provenance":{"connector":"public-reconstruction-v1","evidence_ref":"circleci-2023:assumption-mapping","observed_at":"2026-09-09T00:00:00Z","source_api":"no API called; cited public narrative"},"subtype":"role_assignment"},{"id":"completed-authentication","kind":"constraint","name":"Fictional completed-authentication","provenance":{"connector":"public-reconstruction-v1","evidence_ref":"circleci-2023:assumption-mapping","observed_at":"2026-09-09T00:00:00Z","source_api":"no API called; cited public narrative"},"subtype":"device_required"},{"id":"hypothetical-control","kind":"constraint","name":"Fictional hypothetical-control","provenance":{"connector":"synthetic-v0.1","evidence_ref":"hypothetical-control","observed_at":"2026-09-09T00:00:00Z","source_api":"invented-fixture"},"subtype":"approval_required"}],"observed_at":"2026-09-09T00:00:00Z","organization":"Fictional reconstruction circleci-2023","schema_version":"0.1","synthetic":true}
