{"action_weights":{"administer":5,"read":1,"read_metadata":1,"read_secret":1,"write":3},"coverage":["Offline synthetic Graph/ARM normalization; endpoints were documented, not called against a tenant.","Resource granularity is storage account / vault / explicitly mapped application object, never per blob.","Operation vocabulary is deliberately finite. Unknown resource types and operations are reported, not assumed to grant canonical actions.","Credential inventory, resource sensitivities, AI/workload classification, app/directory-role semantics and PIM approval context are explicit synthetic sidecar inputs, not invented API fields.","Graph v1.0 direct group-members API has a documented service-principal omission; live completeness requires a reviewed workaround and pagination."],"edges":[{"id":"assigned-arm-0d67a43a7095ee825e54425f","kind":"assigned","provenance":{"connector":"entra-azure-offline-v0.1","evidence_ref":"assigned-arm-0d67a43a7095ee825e54425f","observed_at":"2026-09-09T00:00:00Z","source_api":"ARM/roleAssignments"},"source":"principal-ce78442c9dd78edb6046eaf1","target":"arm-0d67a43a7095ee825e54425f"},{"id":"assigned-vault-policy-94afc311be4aa3b2ec298881","kind":"assigned","provenance":{"connector":"entra-azure-offline-v0.1","evidence_ref":"assigned-vault-policy-94afc311be4aa3b2ec298881","observed_at":"2026-09-09T00:00:00Z","source_api":"ARM/vaults/accessPolicies"},"source":"principal-05da638f5292e85665ad49bc","target":"vault-policy-94afc311be4aa3b2ec298881"},{"id":"auth-95942853-be49-5e98-93d2-f48bbe941ba5-metadata","kind":"authenticates_as","provenance":{"connector":"synthetic-v0.1","evidence_ref":"auth-95942853-be49-5e98-93d2-f48bbe941ba5-metadata","observed_at":"2026-09-09T00:00:00Z","source_api":"invented-fixture"},"source":"95942853-be49-5e98-93d2-f48bbe941ba5-metadata","target":"principal-05da638f5292e85665ad49bc"},{"id":"auth-fictional-password-metadata","kind":"authenticates_as","provenance":{"connector":"synthetic-v0.1","evidence_ref":"auth-fictional-password-metadata","observed_at":"2026-09-09T00:00:00Z","source_api":"invented-fixture"},"source":"fictional-password-metadata","target":"principal-c678a989c23f830c8db7dc12"},{"actions":["read_metadata"],"id":"grant-arm-0d67a43a7095ee825e54425f-0","kind":"grants","provenance":{"connector":"entra-azure-offline-v0.1","evidence_ref":"grant-arm-0d67a43a7095ee825e54425f-0","observed_at":"2026-09-09T00:00:00Z","source_api":"ARM/roleAssignments"},"source":"arm-0d67a43a7095ee825e54425f","target":"resource-f4870796b81a1bf9418b6873"},{"actions":["read_secret"],"id":"grant-vault-policy-94afc311be4aa3b2ec298881-0","kind":"grants","provenance":{"connector":"entra-azure-offline-v0.1","evidence_ref":"grant-vault-policy-94afc311be4aa3b2ec298881-0","observed_at":"2026-09-09T00:00:00Z","source_api":"ARM/vaults/accessPolicies"},"source":"vault-policy-94afc311be4aa3b2ec298881","target":"resource-f1c862846fa5b6e195c9d583"},{"id":"member-629b70598b4b9d5765d95fac","kind":"member_of","provenance":{"connector":"synthetic-v0.1","evidence_ref":"member-629b70598b4b9d5765d95fac","observed_at":"2026-09-09T00:00:00Z","source_api":"invented-fixture"},"source":"principal-673da519503c31301bb4468d","target":"principal-151fdb182cc7b62c2df134b1"},{"id":"member-ccccd2dd11bd2c9196ddf31c","kind":"member_of","provenance":{"connector":"synthetic-v0.1","evidence_ref":"member-ccccd2dd11bd2c9196ddf31c","observed_at":"2026-09-09T00:00:00Z","source_api":"invented-fixture"},"source":"principal-c678a989c23f830c8db7dc12","target":"principal-673da519503c31301bb4468d"},{"id":"member-d474486cf29a304c7aad2b94","kind":"member_of","provenance":{"connector":"synthetic-v0.1","evidence_ref":"member-d474486cf29a304c7aad2b94","observed_at":"2026-09-09T00:00:00Z","source_api":"invented-fixture"},"source":"principal-151fdb182cc7b62c2df134b1","target":"principal-ce78442c9dd78edb6046eaf1"}],"nodes":[{"id":"95942853-be49-5e98-93d2-f48bbe941ba5-metadata","kind":"credential","name":"Fictional managed metadata","principal_id":"principal-05da638f5292e85665ad49bc","provenance":{"connector":"entra-azure-offline-v0.1","evidence_ref":"95942853-be49-5e98-93d2-f48bbe941ba5-metadata","observed_at":"2026-09-09T00:00:00Z","source_api":"synthetic-sidecar:credential_inventory"},"subtype":"federated_trust"},{"id":"approval_required","kind":"constraint","name":"Fictional approval_required","provenance":{"connector":"entra-azure-offline-v0.1","evidence_ref":"approval_required","observed_at":"2026-09-09T00:00:00Z","source_api":"synthetic-sidecar:constraint-model"},"subtype":"approval_required"},{"constraints":[],"effect":"allow","eligible":false,"id":"arm-0d67a43a7095ee825e54425f","kind":"binding","name":"Fictional arm-0d67a43a7095ee825e54425f","provenance":{"connector":"entra-azure-offline-v0.1","evidence_ref":"arm-0d67a43a7095ee825e54425f","observed_at":"2026-09-09T00:00:00Z","source_api":"ARM/roleAssignments"},"subtype":"role_assignment"},{"id":"device_required","kind":"constraint","name":"Fictional device_required","provenance":{"connector":"entra-azure-offline-v0.1","evidence_ref":"device_required","observed_at":"2026-09-09T00:00:00Z","source_api":"synthetic-sidecar:constraint-model"},"subtype":"device_required"},{"id":"fictional-password-metadata","kind":"credential","name":"Fictional Vera Glass credential metadata","principal_id":"principal-c678a989c23f830c8db7dc12","provenance":{"connector":"entra-azure-offline-v0.1","evidence_ref":"fictional-password-metadata","observed_at":"2026-09-09T00:00:00Z","source_api":"synthetic-sidecar:credential_inventory"},"subtype":"password"},{"id":"network_restriction","kind":"constraint","name":"Fictional network_restriction","provenance":{"connector":"entra-azure-offline-v0.1","evidence_ref":"network_restriction","observed_at":"2026-09-09T00:00:00Z","source_api":"synthetic-sidecar:constraint-model"},"subtype":"network_restriction"},{"id":"pim_eligible","kind":"constraint","name":"Fictional pim_eligible","provenance":{"connector":"entra-azure-offline-v0.1","evidence_ref":"pim_eligible","observed_at":"2026-09-09T00:00:00Z","source_api":"synthetic-sidecar:constraint-model"},"subtype":"pim_eligible"},{"id":"principal-05da638f5292e85665ad49bc","kind":"principal","name":"Fictional Quartz Identity","provenance":{"connector":"entra-azure-offline-v0.1","evidence_ref":"principal-05da638f5292e85665ad49bc","observed_at":"2026-09-09T00:00:00Z","source_api":"servicePrincipals"},"provisioned_at":null,"subtype":"managed_identity"},{"id":"principal-151fdb182cc7b62c2df134b1","kind":"principal","name":"Fictional Group 1","provenance":{"connector":"entra-azure-offline-v0.1","evidence_ref":"principal-151fdb182cc7b62c2df134b1","observed_at":"2026-09-09T00:00:00Z","source_api":"groups"},"provisioned_at":null,"subtype":"group"},{"id":"principal-673da519503c31301bb4468d","kind":"principal","name":"Fictional Group 0","provenance":{"connector":"entra-azure-offline-v0.1","evidence_ref":"principal-673da519503c31301bb4468d","observed_at":"2026-09-09T00:00:00Z","source_api":"groups"},"provisioned_at":null,"subtype":"group"},{"id":"principal-c678a989c23f830c8db7dc12","kind":"principal","name":"Fictional Vera Glass","provenance":{"connector":"entra-azure-offline-v0.1","evidence_ref":"principal-c678a989c23f830c8db7dc12","observed_at":"2026-09-09T00:00:00Z","source_api":"users"},"provisioned_at":"2026-01-01T00:00:00Z","subtype":"human_user"},{"id":"principal-ce78442c9dd78edb6046eaf1","kind":"principal","name":"Fictional Group 2","provenance":{"connector":"entra-azure-offline-v0.1","evidence_ref":"principal-ce78442c9dd78edb6046eaf1","observed_at":"2026-09-09T00:00:00Z","source_api":"groups"},"provisioned_at":null,"subtype":"group"},{"actions":["read_metadata","read_secret"],"id":"resource-f1c862846fa5b6e195c9d583","kind":"resource","name":"Fictional fablevault","provenance":{"connector":"entra-azure-offline-v0.1","evidence_ref":"resource-f1c862846fa5b6e195c9d583","observed_at":"2026-09-09T00:00:00Z","source_api":"ARM/resources"},"sensitivity":1.0,"subtype":"secret_store"},{"actions":["read_metadata","write"],"id":"resource-f4870796b81a1bf9418b6873","kind":"resource","name":"Fictional fableledger","provenance":{"connector":"entra-azure-offline-v0.1","evidence_ref":"resource-f4870796b81a1bf9418b6873","observed_at":"2026-09-09T00:00:00Z","source_api":"ARM/resources"},"sensitivity":0.5,"subtype":"storage_account"},{"id":"time_window","kind":"constraint","name":"Fictional time_window","provenance":{"connector":"entra-azure-offline-v0.1","evidence_ref":"time_window","observed_at":"2026-09-09T00:00:00Z","source_api":"synthetic-sidecar:constraint-model"},"subtype":"time_window"},{"constraints":[],"effect":"allow","eligible":false,"id":"vault-policy-94afc311be4aa3b2ec298881","kind":"binding","name":"Fictional vault-policy-94afc311be4aa3b2ec298881","provenance":{"connector":"entra-azure-offline-v0.1","evidence_ref":"vault-policy-94afc311be4aa3b2ec298881","observed_at":"2026-09-09T00:00:00Z","source_api":"ARM/vaults/accessPolicies"},"subtype":"role_assignment"}],"observed_at":"2026-09-09T00:00:00Z","organization":"Fictional Copper Meadow","schema_version":"0.1","synthetic":true}
