{"action_weights":{"administer":5,"read":1,"read_metadata":1,"read_secret":1,"write":3},"coverage":["Synthetic modeled capabilities only; no real cloud authorization claim."],"edges":[{"id":"acquire-beta","kind":"can_read_secret","provenance":{"connector":"synthetic-v0.1","evidence_ref":"acquire-beta","observed_at":"2026-09-09T00:00:00Z","source_api":"invented-fixture"},"requires":{"action":"read_secret","resource_id":"r0"},"source":"alpha","target":"credential-beta"},{"id":"assigned-allow","kind":"assigned","provenance":{"connector":"synthetic-v0.1","evidence_ref":"assigned-allow","observed_at":"2026-09-09T00:00:00Z","source_api":"invented-fixture"},"source":"alpha","target":"allow"},{"id":"assigned-beta-write","kind":"assigned","provenance":{"connector":"synthetic-v0.1","evidence_ref":"assigned-beta-write","observed_at":"2026-09-09T00:00:00Z","source_api":"invented-fixture"},"source":"beta","target":"beta-write"},{"id":"auth-alpha","kind":"authenticates_as","provenance":{"connector":"synthetic-v0.1","evidence_ref":"auth-alpha","observed_at":"2026-09-09T00:00:00Z","source_api":"invented-fixture"},"source":"credential-alpha","target":"alpha"},{"id":"auth-beta","kind":"authenticates_as","provenance":{"connector":"synthetic-v0.1","evidence_ref":"auth-beta","observed_at":"2026-09-09T00:00:00Z","source_api":"invented-fixture"},"source":"credential-beta","target":"beta"},{"actions":["read_metadata"],"id":"grant-allow-0","kind":"grants","provenance":{"connector":"synthetic-v0.1","evidence_ref":"grant-allow-0","observed_at":"2026-09-09T00:00:00Z","source_api":"invented-fixture"},"source":"allow","target":"r0"},{"actions":["write"],"id":"grant-beta-write-0","kind":"grants","provenance":{"connector":"synthetic-v0.1","evidence_ref":"grant-beta-write-0","observed_at":"2026-09-09T00:00:00Z","source_api":"invented-fixture"},"source":"beta-write","target":"r1"}],"nodes":[{"constraints":[],"effect":"allow","eligible":false,"id":"allow","kind":"binding","name":"Fictional allow","provenance":{"connector":"synthetic-v0.1","evidence_ref":"allow","observed_at":"2026-09-09T00:00:00Z","source_api":"invented-fixture"},"subtype":"role_assignment"},{"id":"alpha","kind":"principal","name":"Fictional Alba Rune","provenance":{"connector":"synthetic-v0.1","evidence_ref":"alpha","observed_at":"2026-09-09T00:00:00Z","source_api":"invented-fixture"},"provisioned_at":"2026-08-01T00:00:00Z","subtype":"human_user"},{"id":"beta","kind":"principal","name":"Fictional beta","provenance":{"connector":"synthetic-v0.1","evidence_ref":"beta","observed_at":"2026-09-09T00:00:00Z","source_api":"invented-fixture"},"provisioned_at":"2026-08-01T00:00:00Z","subtype":"service_principal"},{"constraints":[],"effect":"allow","eligible":false,"id":"beta-write","kind":"binding","name":"Fictional beta-write","provenance":{"connector":"synthetic-v0.1","evidence_ref":"beta-write","observed_at":"2026-09-09T00:00:00Z","source_api":"invented-fixture"},"subtype":"role_assignment"},{"id":"credential-alpha","kind":"credential","name":"Fictional Alba Rune metadata","principal_id":"alpha","provenance":{"connector":"synthetic-v0.1","evidence_ref":"credential-alpha","observed_at":"2026-09-09T00:00:00Z","source_api":"invented-fixture"},"subtype":"key"},{"id":"credential-beta","kind":"credential","name":"Fictional beta metadata","principal_id":"beta","provenance":{"connector":"synthetic-v0.1","evidence_ref":"credential-beta","observed_at":"2026-09-09T00:00:00Z","source_api":"invented-fixture"},"subtype":"key"},{"actions":["read_metadata","read_secret"],"id":"r0","kind":"resource","name":"Fictional r0","provenance":{"connector":"synthetic-v0.1","evidence_ref":"r0","observed_at":"2026-09-09T00:00:00Z","source_api":"invented-fixture"},"sensitivity":0.2,"subtype":"secret_store"},{"actions":["read","write"],"id":"r1","kind":"resource","name":"Fictional r1","provenance":{"connector":"synthetic-v0.1","evidence_ref":"r1","observed_at":"2026-09-09T00:00:00Z","source_api":"invented-fixture"},"sensitivity":0.8,"subtype":"database"}],"observed_at":"2026-09-09T00:00:00Z","organization":"Fictional Conformance Garden","schema_version":"0.1","synthetic":true}
