{"action_weights":{"administer":5,"read":1,"read_metadata":1,"read_secret":1,"write":3},"coverage":["Synthetic modeled capabilities only; no real cloud authorization claim."],"edges":[],"nodes":[{"constraints":[],"effect":"allow","eligible":false,"id":"allow","kind":"binding","name":"Fictional allow","provenance":{"connector":"synthetic-v0.1","evidence_ref":"allow","observed_at":"2026-09-09T00:00:00Z","source_api":"invented-fixture"},"subtype":"role_assignment"},{"id":"alpha","kind":"principal","name":"Fictional Alba Rune","provenance":{"connector":"synthetic-v0.1","evidence_ref":"alpha","observed_at":"2026-09-09T00:00:00Z","source_api":"invented-fixture"},"provisioned_at":"2026-08-01T00:00:00Z","subtype":"human_user"},{"id":"credential-alpha","kind":"credential","name":"Fictional Alba Rune metadata","principal_id":"alpha","provenance":{"connector":"synthetic-v0.1","evidence_ref":"credential-alpha","observed_at":"2026-09-09T00:00:00Z","source_api":"invented-fixture"},"subtype":"key"}],"observed_at":"2026-09-09T00:00:00Z","organization":"Fictional Conformance Garden","schema_version":"0.1","synthetic":true}
