{"action_weights":{"administer":5,"read":1,"read_metadata":1,"read_secret":1,"write":3},"coverage":["Synthetic modeled capabilities only; no real cloud authorization claim."],"edges":[{"id":"assigned-allow","kind":"assigned","provenance":{"connector":"synthetic-v0.1","evidence_ref":"assigned-allow","observed_at":"2026-09-09T00:00:00Z","source_api":"invented-fixture"},"source":"alpha","target":"allow"},{"id":"auth-alpha","kind":"authenticates_as","provenance":{"connector":"synthetic-v0.1","evidence_ref":"auth-alpha","observed_at":"2026-09-09T00:00:00Z","source_api":"invented-fixture"},"source":"credential-alpha","target":"alpha"},{"actions":["read"],"id":"grant-allow-0","kind":"grants","provenance":{"connector":"synthetic-v0.1","evidence_ref":"grant-allow-0","observed_at":"2026-09-09T00:00:00Z","source_api":"invented-fixture"},"source":"allow","target":"r0"}],"nodes":[{"constraints":["approval_required","pim_eligible"],"effect":"allow","eligible":true,"id":"allow","kind":"binding","name":"Fictional allow","provenance":{"connector":"synthetic-v0.1","evidence_ref":"allow","observed_at":"2026-09-09T00:00:00Z","source_api":"invented-fixture"},"subtype":"role_assignment"},{"id":"alpha","kind":"principal","name":"Fictional Alba Rune","provenance":{"connector":"synthetic-v0.1","evidence_ref":"alpha","observed_at":"2026-09-09T00:00:00Z","source_api":"invented-fixture"},"provisioned_at":"2026-08-01T00:00:00Z","subtype":"human_user"},{"id":"approval_required","kind":"constraint","name":"Fictional approval_required","provenance":{"connector":"synthetic-v0.1","evidence_ref":"approval_required","observed_at":"2026-09-09T00:00:00Z","source_api":"invented-fixture"},"subtype":"approval_required"},{"id":"credential-alpha","kind":"credential","name":"Fictional Alba Rune metadata","principal_id":"alpha","provenance":{"connector":"synthetic-v0.1","evidence_ref":"credential-alpha","observed_at":"2026-09-09T00:00:00Z","source_api":"invented-fixture"},"subtype":"key"},{"id":"pim_eligible","kind":"constraint","name":"Fictional pim_eligible","provenance":{"connector":"synthetic-v0.1","evidence_ref":"pim_eligible","observed_at":"2026-09-09T00:00:00Z","source_api":"invented-fixture"},"subtype":"pim_eligible"},{"actions":["read","write"],"id":"r0","kind":"resource","name":"Fictional r0","provenance":{"connector":"synthetic-v0.1","evidence_ref":"r0","observed_at":"2026-09-09T00:00:00Z","source_api":"invented-fixture"},"sensitivity":0.2,"subtype":"database"},{"actions":["read","write"],"id":"r1","kind":"resource","name":"Fictional r1","provenance":{"connector":"synthetic-v0.1","evidence_ref":"r1","observed_at":"2026-09-09T00:00:00Z","source_api":"invented-fixture"},"sensitivity":0.8,"subtype":"database"}],"observed_at":"2026-09-09T00:00:00Z","organization":"Fictional Conformance Garden","schema_version":"0.1","synthetic":true}
