{"action_weights":{"administer":5,"read":1,"read_metadata":1,"read_secret":1,"write":3},"coverage":["Synthetic modeled capabilities only; no real cloud authorization claim."],"edges":[{"id":"assigned-group","kind":"assigned","provenance":{"connector":"synthetic-v0.1","evidence_ref":"assigned-group","observed_at":"2026-09-09T00:00:00Z","source_api":"invented-fixture"},"source":"group2","target":"allow"},{"id":"auth-alpha","kind":"authenticates_as","provenance":{"connector":"synthetic-v0.1","evidence_ref":"auth-alpha","observed_at":"2026-09-09T00:00:00Z","source_api":"invented-fixture"},"source":"credential-alpha","target":"alpha"},{"actions":["read"],"id":"grant-allow-0","kind":"grants","provenance":{"connector":"synthetic-v0.1","evidence_ref":"grant-allow-0","observed_at":"2026-09-09T00:00:00Z","source_api":"invented-fixture"},"source":"allow","target":"r0"},{"id":"member0","kind":"member_of","provenance":{"connector":"synthetic-v0.1","evidence_ref":"member0","observed_at":"2026-09-09T00:00:00Z","source_api":"invented-fixture"},"source":"alpha","target":"group0"},{"id":"member1","kind":"member_of","provenance":{"connector":"synthetic-v0.1","evidence_ref":"member1","observed_at":"2026-09-09T00:00:00Z","source_api":"invented-fixture"},"source":"group0","target":"group1"},{"id":"member2","kind":"member_of","provenance":{"connector":"synthetic-v0.1","evidence_ref":"member2","observed_at":"2026-09-09T00:00:00Z","source_api":"invented-fixture"},"source":"group1","target":"group2"}],"nodes":[{"constraints":[],"effect":"allow","eligible":false,"id":"allow","kind":"binding","name":"Fictional allow","provenance":{"connector":"synthetic-v0.1","evidence_ref":"allow","observed_at":"2026-09-09T00:00:00Z","source_api":"invented-fixture"},"subtype":"role_assignment"},{"id":"alpha","kind":"principal","name":"Fictional Alba Rune","provenance":{"connector":"synthetic-v0.1","evidence_ref":"alpha","observed_at":"2026-09-09T00:00:00Z","source_api":"invented-fixture"},"provisioned_at":"2026-08-01T00:00:00Z","subtype":"human_user"},{"id":"credential-alpha","kind":"credential","name":"Fictional Alba Rune metadata","principal_id":"alpha","provenance":{"connector":"synthetic-v0.1","evidence_ref":"credential-alpha","observed_at":"2026-09-09T00:00:00Z","source_api":"invented-fixture"},"subtype":"key"},{"id":"group0","kind":"principal","name":"Fictional group0","provenance":{"connector":"synthetic-v0.1","evidence_ref":"group0","observed_at":"2026-09-09T00:00:00Z","source_api":"invented-fixture"},"subtype":"group"},{"id":"group1","kind":"principal","name":"Fictional group1","provenance":{"connector":"synthetic-v0.1","evidence_ref":"group1","observed_at":"2026-09-09T00:00:00Z","source_api":"invented-fixture"},"subtype":"group"},{"id":"group2","kind":"principal","name":"Fictional group2","provenance":{"connector":"synthetic-v0.1","evidence_ref":"group2","observed_at":"2026-09-09T00:00:00Z","source_api":"invented-fixture"},"subtype":"group"},{"actions":["read","write"],"id":"r0","kind":"resource","name":"Fictional r0","provenance":{"connector":"synthetic-v0.1","evidence_ref":"r0","observed_at":"2026-09-09T00:00:00Z","source_api":"invented-fixture"},"sensitivity":0.2,"subtype":"database"},{"actions":["read","write"],"id":"r1","kind":"resource","name":"Fictional r1","provenance":{"connector":"synthetic-v0.1","evidence_ref":"r1","observed_at":"2026-09-09T00:00:00Z","source_api":"invented-fixture"},"sensitivity":0.8,"subtype":"database"}],"observed_at":"2026-09-09T00:00:00Z","organization":"Fictional Conformance Garden","schema_version":"0.1","synthetic":true}
