{"action_weights":{"administer":5,"read":1,"read_metadata":1,"read_secret":1,"write":3},"coverage":["Minimal public-record mechanism model; all unreported topology is explicitly assumed.","The reported zero-day chain, arbitrary code execution and multi-agent collaboration exceed the single-credential authorization-only model. That is an explicit limit of the metric, not evidence that it predicted all impact."],"edges":[{"id":"auth-subject","kind":"authenticates_as","provenance":{"connector":"public-reconstruction-v1","evidence_ref":"huggingface-2026:assumption-mapping","observed_at":"2026-09-09T00:00:00Z","source_api":"no API called; cited public narrative"},"source":"credential-subject","target":"subject"},{"id":"assigned-reported-capability","kind":"assigned","provenance":{"connector":"public-reconstruction-v1","evidence_ref":"huggingface-2026:assumption-mapping","observed_at":"2026-09-09T00:00:00Z","source_api":"no API called; cited public narrative"},"source":"subject","target":"reported-capability"},{"actions":["write"],"id":"grant-reported-capability-0","kind":"grants","provenance":{"connector":"public-reconstruction-v1","evidence_ref":"huggingface-2026:assumption-mapping","observed_at":"2026-09-09T00:00:00Z","source_api":"no API called; cited public narrative"},"source":"reported-capability","target":"hosted-project"}],"nodes":[{"id":"subject","kind":"principal","name":"Fictional disclosed-credential role","provenance":{"connector":"public-reconstruction-v1","evidence_ref":"huggingface-2026:assumption-mapping","observed_at":"2026-09-09T00:00:00Z","source_api":"no API called; cited public narrative"},"provisioned_at":"2026-08-01T00:00:00Z","subtype":"human_user"},{"id":"credential-subject","kind":"credential","name":"Fictional disclosed-credential role metadata","principal_id":"subject","provenance":{"connector":"public-reconstruction-v1","evidence_ref":"huggingface-2026:assumption-mapping","observed_at":"2026-09-09T00:00:00Z","source_api":"no API called; cited public narrative"},"subtype":"token"},{"actions":["write"],"id":"hosted-project","kind":"resource","name":"Fictional hosted-project","provenance":{"connector":"public-reconstruction-v1","evidence_ref":"huggingface-2026:assumption-mapping","observed_at":"2026-09-09T00:00:00Z","source_api":"no API called; cited public narrative"},"sensitivity":1,"subtype":"collection"},{"constraints":[],"effect":"allow","eligible":false,"id":"reported-capability","kind":"binding","name":"Fictional reported-capability","provenance":{"connector":"public-reconstruction-v1","evidence_ref":"huggingface-2026:assumption-mapping","observed_at":"2026-09-09T00:00:00Z","source_api":"no API called; cited public narrative"},"subtype":"role_assignment"}],"observed_at":"2026-09-09T00:00:00Z","organization":"Fictional reconstruction huggingface-2026","schema_version":"0.1","synthetic":true}
